texto,sentimiento,tokens,texto_procesado,prediccion_svm,prediccion_nb
muy ni promedio bueno malo bastante ni,neutro,"['promedi', 'buen', 'mal', 'bastant']",promedi buen mal bastant,neutro,neutro
buenísimo ciertamente estado llegó tiempo perfecto recomiendo,positivo,"['buenisim', 'ciert', 'lleg', 'tiemp', 'perfect', 'recom']",buenisim ciert lleg tiemp perfect recom,positivo,positivo
inseguro abominable producto evitar peligroso,negativo,"['insegur', 'abomin', 'product', 'evit', 'peligr']",insegur abomin product evit peligr,negativo,negativo
suficiente cubre necesidades ciertamente mínimas aceptable,neutro,"['suficient', 'cubr', 'neces', 'ciert', 'minim', 'acept']",suficient cubr neces ciert minim acept,neutro,neutro
resistente increíblemente absolutamente confiable bueno duradero,positivo,"['resistent', 'increibl', 'absolut', 'confiabl', 'buen', 'durader']",resistent increibl absolut confiabl buen durader,positivo,positivo
genial satisfecho realmente perfectamente funciones cumple,positivo,"['genial', 'satisfech', 'realment', 'perfect', 'funcion', 'cumpl']",genial satisfech realment perfect funcion cumpl,positivo,positivo
buscaba muy muy justo espectacular contento,positivo,"['busc', 'just', 'espectacul', 'content']",busc just espectacul content,positivo,positivo
muy patético expectativas rendimiento defraudado bajo,negativo,"['patet', 'expect', 'rendimient', 'defraud', 'baj']",patet expect rendimient defraud baj,negativo,negativo
inicio defectuoso desde mal malísimo absolutamente funciona,negativo,"['inici', 'defectu', 'mal', 'malisim', 'absolut', 'funcion']",inici defectu mal malisim absolut funcion,negativo,negativo
satisfecho funciones cumple genial absolutamente perfectamente,positivo,"['satisfech', 'funcion', 'cumpl', 'genial', 'absolut', 'perfect']",satisfech funcion cumpl genial absolut perfect,positivo,positivo
fabuloso elegante práctico realmente funcional diseño,positivo,"['fabul', 'eleg', 'practic', 'realment', 'funcional', 'diseñ']",fabul eleg practic realment funcional diseñ,positivo,positivo
simple sin funcional lujos básico,neutro,"['simpl', 'funcional', 'luj', 'basic']",simpl funcional luj basic,neutro,neutro
pena vale calidad inversión alta maravilloso,positivo,"['pen', 'val', 'calid', 'inversion', 'alta', 'maravill']",pen val calid inversion alta maravill,positivo,positivo
media gama desempeño esperado mediano,neutro,"['medi', 'gam', 'desempeñ', 'esper', 'median']",medi gam desempeñ esper median,neutro,neutro
feliz descripción supera extraordinario compra muy,positivo,"['feliz', 'descripcion', 'super', 'extraordinari', 'compr']",feliz descripcion super extraordinari compr,positivo,positivo
aceptable suficiente mínimas necesidades ciertamente cubre,neutro,"['acept', 'suficient', 'minim', 'neces', 'ciert', 'cubr']",acept suficient minim neces ciert cubr,neutro,neutro
fraudulento producto definitivamente barata falsificado imitación,negativo,"['fraudulent', 'product', 'definit', 'barat', 'falsific', 'imit']",fraudulent product definit barat falsific imit,negativo,negativo
expectativas rendimiento patético muy defraudado bajo,negativo,"['expect', 'rendimient', 'patet', 'defraud', 'baj']",expect rendimient patet defraud baj,negativo,negativo
aceptable mínimas suficiente muy necesidades cubre,neutro,"['acept', 'minim', 'suficient', 'neces', 'cubr']",acept minim suficient neces cubr,neutro,neutro
sirve temporal pasable emergencia solución,neutro,"['sirv', 'temporal', 'pasabl', 'emergent', 'solucion']",sirv temporal pasabl emergent solucion,neutro,neutro
funcional sin básico lujos simple,neutro,"['funcional', 'basic', 'luj', 'simpl']",funcional basic luj simpl,neutro,neutro
aceptable necesidades mínimas suficiente cubre,neutro,"['acept', 'neces', 'minim', 'suficient', 'cubr']",acept neces minim suficient cubr,neutro,neutro
particular sin problemas totalmente decente funciona,neutro,"['particul', 'problem', 'total', 'decent', 'funcion']",particul problem total decent funcion,neutro,neutro
cumple perfectamente funciones bastante satisfecho genial,positivo,"['cumpl', 'perfect', 'funcion', 'bastant', 'satisfech', 'genial']",cumpl perfect funcion bastant satisfech genial,positivo,positivo
premium calidad producto magnífico excepcional,positivo,"['premium', 'calid', 'product', 'magnif', 'excepcional']",premium calid product magnif excepcional,positivo,positivo
esperaba estrellas cinco exactamente perfecto,positivo,"['esper', 'estrell', 'cinc', 'exact', 'perfect']",esper estrell cinc exact perfect,positivo,positivo
terrible aquí compraré nunca más experiencia,negativo,"['terribl', 'aqu', 'compr', 'nunc', 'experient']",terribl aqu compr nunc experient,negativo,negativo
brillante diario solución uso problema perfecto,positivo,"['brillant', 'diari', 'solucion', 'uso', 'problem', 'perfect']",brillant diari solucion uso problem perfect,positivo,positivo
recomiendo sin duda buenísimo tiempo estado llegó perfecto,positivo,"['recom', 'dud', 'buenisim', 'tiemp', 'lleg', 'perfect']",recom dud buenisim tiemp lleg perfect,positivo,positivo
destacable cumple sin más descripción,neutro,"['destac', 'cumpl', 'descripcion']",destac cumpl descripcion,neutro,neutro
hecho mejor inversión recomiendo sensacional ampliamente,positivo,"['hech', 'mejor', 'inversion', 'recom', 'sensacional', 'ampli']",hech mejor inversion recom sensacional ampli,positivo,positivo
dinero recomiendo completamente tiempo no pérdida,negativo,"['diner', 'recom', 'complet', 'tiemp', 'perd']",diner recom complet tiemp perd,negativo,negativo
insatisfecho compra muy no propósito sirve,negativo,"['insatisfech', 'compr', 'proposit', 'sirv']",insatisfech compr proposit sirv,negativo,negativo
completamente impresionante ordinario corriente común nada,neutro,"['complet', 'impresion', 'ordinari', 'corrient', 'comun']",complet impresion ordinari corrient comun,neutro,neutro
precio producto totalmente bastante excelente recomiendo calidad,positivo,"['preci', 'product', 'total', 'bastant', 'excelent', 'recom', 'calid']",preci product total bastant excelent recom calid,positivo,positivo
construcción calidad fácil espantoso endeble rompe,negativo,"['construccion', 'calid', 'facil', 'espant', 'endebl', 'romp']",construccion calid facil espant endebl romp,negativo,negativo
solución diario perfecto realmente uso brillante problema,positivo,"['solucion', 'diari', 'perfect', 'realment', 'uso', 'brillant', 'problem']",solucion diari perfect realment uso brillant problem,positivo,positivo
no sirve insatisfecho compra bastante muy propósito,negativo,"['sirv', 'insatisfech', 'compr', 'bastant', 'proposit']",sirv insatisfech compr bastant proposit,negativo,negativo
mínimas cubre suficiente necesidades aceptable,neutro,"['minim', 'cubr', 'suficient', 'neces', 'acept']",minim cubr suficient neces acept,neutro,neutro
satisfecho comprar volveré definitivamente absolutamente tremendamente,positivo,"['satisfech', 'compr', 'volv', 'definit', 'absolut', 'tremend']",satisfech compr volv definit absolut tremend,positivo,positivo
defraudado rendimiento expectativas patético bajo,negativo,"['defraud', 'rendimient', 'expect', 'patet', 'baj']",defraud rendimient expect patet baj,negativo,negativo
frágil construcción baratos pobre sin duda materiales,negativo,"['fragil', 'construccion', 'barat', 'pobr', 'dud', 'material']",fragil construccion barat pobr dud material,negativo,negativo
sin funciona problemas decente particular,neutro,"['funcion', 'problem', 'decent', 'particul']",funcion problem decent particul,neutro,neutro
producto caro lamentable sobrevalorado mediocre,negativo,"['product', 'car', 'lament', 'sobrevalor', 'mediocr']",product car lament sobrevalor mediocr,negativo,negativo
razonable pagado precio correcto para,neutro,"['razon', 'pag', 'preci', 'correct']",razon pag preci correct,neutro,neutro
justo buscaba contento espectacular muy,positivo,"['just', 'busc', 'content', 'espectacul']",just busc content espectacul,positivo,positivo
está producto nada especial cumple bien,neutro,"['product', 'especial', 'cumpl', 'bien']",product especial cumpl bien,neutro,neutro
compra fantástico mejor año definitivamente volveré,positivo,"['compr', 'fantast', 'mejor', 'año', 'definit', 'volv']",compr fantast mejor año definit volv,positivo,positivo
definitivamente definitivamente satisfecho comprar volveré tremendamente,positivo,"['definit', 'definit', 'satisfech', 'compr', 'volv', 'tremend']",definit definit satisfech compr volv tremend,positivo,positivo
producto está completamente bien nada especial cumple,neutro,"['product', 'complet', 'bien', 'especial', 'cumpl']",product complet bien especial cumpl,neutro,neutro
más compraré aquí terrible absolutamente experiencia nunca,negativo,"['compr', 'aqu', 'terribl', 'absolut', 'experient', 'nunc']",compr aqu terribl absolut experient nunc,negativo,negativo
peor vida nefasto arrepentido compra,negativo,"['peor', 'vid', 'nefast', 'arrepent', 'compr']",peor vid nefast arrepent compr,negativo,negativo
básico simple funcional lujos ciertamente sin,neutro,"['basic', 'simpl', 'funcional', 'luj', 'ciert']",basic simpl funcional luj ciert,neutro,neutro
recomiendo no tiempo pérdida dinero,negativo,"['recom', 'tiemp', 'perd', 'diner']",recom tiemp perd diner,negativo,negativo
fantástico año volveré definitivamente mejor compra,positivo,"['fantast', 'año', 'volv', 'definit', 'mejor', 'compr']",fantast año volv definit mejor compr,positivo,positivo
duda sin opción sobresaliente mercado mejor,positivo,"['dud', 'opcion', 'sobresalient', 'merc', 'mejor']",dud opcion sobresalient merc mejor,positivo,positivo
peor arrepentido vida nefasto compra,negativo,"['peor', 'arrepent', 'vid', 'nefast', 'compr']",peor arrepent vid nefast compr,negativo,negativo
aquí definitivamente nunca terrible compraré experiencia más,negativo,"['aqu', 'definit', 'nunc', 'terribl', 'compr', 'experient']",aqu definit nunc terribl compr experient,negativo,negativo
experiencia nunca terrible más completamente aquí compraré,negativo,"['experient', 'nunc', 'terribl', 'complet', 'aqu', 'compr']",experient nunc terribl complet aqu compr,negativo,negativo
básico extraordinario nada adecuado propósito,neutro,"['basic', 'extraordinari', 'adecu', 'proposit']",basic extraordinari adecu proposit,neutro,neutro
bastante malas ok cosas tiene buenas está,neutro,"['bastant', 'mal', 'cos', 'buen']",bastant mal cos buen,neutro,neutro
sin duda opción sobresaliente mejor mercado,positivo,"['dud', 'opcion', 'sobresalient', 'mejor', 'merc']",dud opcion sobresalient mejor merc,positivo,positivo
construcción frágil totalmente baratos materiales pobre,negativo,"['construccion', 'fragil', 'total', 'barat', 'material', 'pobr']",construccion fragil total barat material pobr,negativo,negativo
completamente inicio desde mal funciona defectuoso malísimo,negativo,"['complet', 'inici', 'mal', 'funcion', 'defectu', 'malisim']",complet inici mal funcion defectu malisim,negativo,negativo
premium sin duda magnífico producto excepcional calidad,positivo,"['premium', 'dud', 'magnif', 'product', 'excepcional', 'calid']",premium dud magnif product excepcional calid,positivo,positivo
tremendamente volveré satisfecho comprar totalmente definitivamente,positivo,"['tremend', 'volv', 'satisfech', 'compr', 'total', 'definit']",tremend volv satisfech compr total definit,positivo,positivo
resistente duradero increíblemente bueno confiable,positivo,"['resistent', 'durader', 'increibl', 'buen', 'confiabl']",resistent durader increibl buen confiabl,positivo,positivo
justo buscaba contento espectacular muy,positivo,"['just', 'busc', 'content', 'espectacul']",just busc content espectacul,positivo,positivo
producto está bien nada especial cumple,neutro,"['product', 'bien', 'especial', 'cumpl']",product bien especial cumpl,neutro,neutro
funcional simple básico sin lujos,neutro,"['funcional', 'simpl', 'basic', 'luj']",funcional simpl basic luj,neutro,neutro
excelente construcción impresionante calidad durabilidad,positivo,"['excelent', 'construccion', 'impresion', 'calid', 'durabil']",excelent construccion impresion calid durabil,positivo,positivo
definitivamente evitar inseguro producto peligroso abominable,negativo,"['definit', 'evit', 'insegur', 'product', 'peligr', 'abomin']",definit evit insegur product peligr abomin,negativo,negativo
problema solución uso perfecto diario brillante,positivo,"['problem', 'solucion', 'uso', 'perfect', 'diari', 'brillant']",problem solucion uso perfect diari brillant,positivo,positivo
formidable cumple honesto vendedor promesas,positivo,"['formid', 'cumpl', 'honest', 'vendedor', 'promes']",formid cumpl honest vendedor promes,positivo,positivo
deplorable atención cliente ciertamente nulo servicio,negativo,"['deplor', 'atencion', 'client', 'ciert', 'nul', 'servici']",deplor atencion client ciert nul servici,negativo,negativo
realmente elegante práctico diseño fabuloso funcional,positivo,"['realment', 'eleg', 'practic', 'diseñ', 'fabul', 'funcional']",realment eleg practic diseñ fabul funcional,positivo,positivo
malas está ok buenas cosas tiene,neutro,"['mal', 'buen', 'cos']",mal buen cos,neutro,neutro
realmente rápido increíble perfecto servicio bien empaquetado,positivo,"['realment', 'rap', 'increibl', 'perfect', 'servici', 'bien', 'empaquet']",realment rap increibl perfect servici bien empaquet,positivo,positivo
impresionante sin duda común nada corriente ordinario,neutro,"['impresion', 'dud', 'comun', 'corrient', 'ordinari']",impresion dud comun corrient ordinari,neutro,neutro
sobresaliente duda mercado ciertamente sin opción mejor,positivo,"['sobresalient', 'dud', 'merc', 'ciert', 'opcion', 'mejor']",sobresalient dud merc ciert opcion mejor,positivo,positivo
estado perfecto buenísimo recomiendo tiempo llegó,positivo,"['perfect', 'buenisim', 'recom', 'tiemp', 'lleg']",perfect buenisim recom tiemp lleg,positivo,positivo
buscaba espectacular muy justo definitivamente contento,positivo,"['busc', 'espectacul', 'just', 'definit', 'content']",busc espectacul just definit content,positivo,positivo
ni malo muy promedio ni bueno,neutro,"['mal', 'promedi', 'buen']",mal promedi buen,neutro,neutro
tiempo absolutamente recomiendo dinero pérdida no,negativo,"['tiemp', 'absolut', 'recom', 'diner', 'perd']",tiemp absolut recom diner perd,negativo,negativo
barata falsificado imitación producto fraudulento,negativo,"['barat', 'falsific', 'imit', 'product', 'fraudulent']",barat falsific imit product fraudulent,negativo,negativo
calidad estándar promedio mercado regular,neutro,"['calid', 'estand', 'promedi', 'merc', 'regul']",calid estand promedi merc regul,neutro,neutro
solución uso problema perfecto diario brillante,positivo,"['solucion', 'uso', 'problem', 'perfect', 'diari', 'brillant']",solucion uso problem perfect diari brillant,positivo,positivo
pésimo funciona hecho sin duda producto no mal,negativo,"['pesim', 'funcion', 'hech', 'dud', 'product', 'mal']",pesim funcion hech dud product mal,negativo,negativo
cubre suficiente aceptable necesidades mínimas,neutro,"['cubr', 'suficient', 'acept', 'neces', 'minim']",cubr suficient acept neces minim,neutro,neutro
expectativas bajo rendimiento defraudado patético,negativo,"['expect', 'baj', 'rendimient', 'defraud', 'patet']",expect baj rendimient defraud patet,negativo,negativo
nada básico adecuado extraordinario propósito,neutro,"['basic', 'adecu', 'extraordinari', 'proposit']",basic adecu extraordinari proposit,neutro,neutro
producto mediocre lamentable caro sobrevalorado,negativo,"['product', 'mediocr', 'lament', 'car', 'sobrevalor']",product mediocr lament car sobrevalor,negativo,negativo
pasable muy emergencia sirve temporal solución,neutro,"['pasabl', 'emergent', 'sirv', 'temporal', 'solucion']",pasabl emergent sirv temporal solucion,neutro,neutro
producto mediocre sobrevalorado caro lamentable,negativo,"['product', 'mediocr', 'sobrevalor', 'car', 'lament']",product mediocr sobrevalor car lament,negativo,negativo
regular calidad mercado promedio estándar,neutro,"['regul', 'calid', 'merc', 'promedi', 'estand']",regul calid merc promedi estand,neutro,neutro
tiempo recomiendo dinero pérdida no,negativo,"['tiemp', 'recom', 'diner', 'perd']",tiemp recom diner perd,negativo,negativo
feliz supera descripción extraordinario compra muy,positivo,"['feliz', 'super', 'descripcion', 'extraordinari', 'compr']",feliz super descripcion extraordinari compr,positivo,positivo
producto mediocre lamentable caro sobrevalorado,negativo,"['product', 'mediocr', 'lament', 'car', 'sobrevalor']",product mediocr lament car sobrevalor,negativo,negativo
engañosa publicidad no cumple decepcionante promete,negativo,"['engañ', 'public', 'cumpl', 'decepcion', 'promet']",engañ public cumpl decepcion promet,negativo,negativo
fácil rompe construcción endeble espantoso calidad,negativo,"['facil', 'romp', 'construccion', 'endebl', 'espant', 'calid']",facil romp construccion endebl espant calid,negativo,negativo
lujos simple funcional básico sin,neutro,"['luj', 'simpl', 'funcional', 'basic']",luj simpl funcional basic,neutro,neutro
mínimas aceptable necesidades totalmente suficiente cubre,neutro,"['minim', 'acept', 'neces', 'total', 'suficient', 'cubr']",minim acept neces total suficient cubr,neutro,neutro
frágil construcción materiales baratos sin duda pobre,negativo,"['fragil', 'construccion', 'material', 'barat', 'dud', 'pobr']",fragil construccion material barat dud pobr,negativo,negativo
pérdida tiempo dinero recomiendo no,negativo,"['perd', 'tiemp', 'diner', 'recom']",perd tiemp diner recom,negativo,negativo
promedio muy ni ni bueno malo,neutro,"['promedi', 'buen', 'mal']",promedi buen mal,neutro,neutro
ciertamente estado tiempo perfecto recomiendo llegó buenísimo,positivo,"['ciert', 'tiemp', 'perfect', 'recom', 'lleg', 'buenisim']",ciert tiemp perfect recom lleg buenisim,positivo,positivo
vale calidad ciertamente maravilloso inversión pena alta,positivo,"['val', 'calid', 'ciert', 'maravill', 'inversion', 'pen', 'alta']",val calid ciert maravill inversion pen alta,positivo,positivo
desproporcionado precio totalmente injusto calidad inaceptable,negativo,"['desproporcion', 'preci', 'total', 'injust', 'calid', 'inacept']",desproporcion preci total injust calid inacept,negativo,negativo
simple funcional básico sin lujos,neutro,"['simpl', 'funcional', 'basic', 'luj']",simpl funcional basic luj,neutro,neutro
mediano gama desempeño media esperado,neutro,"['median', 'gam', 'desempeñ', 'medi', 'esper']",median gam desempeñ medi esper,neutro,neutro
gama media esperado mediano desempeño,neutro,"['gam', 'medi', 'esper', 'median', 'desempeñ']",gam medi esper median desempeñ,neutro,neutro
producto mediocre sobrevalorado caro lamentable,negativo,"['product', 'mediocr', 'sobrevalor', 'car', 'lament']",product mediocr sobrevalor car lament,negativo,negativo
inútil malo desastroso incómodo diseño,negativo,"['inutil', 'mal', 'desastr', 'incomod', 'diseñ']",inutil mal desastr incomod diseñ,negativo,negativo
cliente atención realmente servicio nulo deplorable,negativo,"['client', 'atencion', 'realment', 'servici', 'nul', 'deplor']",client atencion realment servici nul deplor,negativo,negativo
sin funciona particular definitivamente problemas decente,neutro,"['funcion', 'particul', 'definit', 'problem', 'decent']",funcion particul definit problem decent,neutro,neutro
formidable cumple bastante promesas honesto vendedor,positivo,"['formid', 'cumpl', 'bastant', 'promes', 'honest', 'vendedor']",formid cumpl bastant promes honest vendedor,positivo,positivo
uso decepcionante calidad primer rompió muy mala,negativo,"['uso', 'decepcion', 'calid', 'prim', 'romp', 'mal']",uso decepcion calid prim romp mal,negativo,negativo
producto nada está cumple bien totalmente especial,neutro,"['product', 'cumpl', 'bien', 'total', 'especial']",product cumpl bien total especial,neutro,neutro
cumple genial perfectamente funciones satisfecho,positivo,"['cumpl', 'genial', 'perfect', 'funcion', 'satisfech']",cumpl genial perfect funcion satisfech,positivo,positivo
está ok bastante malas buenas tiene cosas,neutro,"['bastant', 'mal', 'buen', 'cos']",bastant mal buen cos,neutro,neutro
sensacional mejor completamente inversión ampliamente recomiendo hecho,positivo,"['sensacional', 'mejor', 'complet', 'inversion', 'ampli', 'recom', 'hech']",sensacional mejor complet inversion ampli recom hech,positivo,positivo
increíble servicio rápido bien empaquetado perfecto,positivo,"['increibl', 'servici', 'rap', 'bien', 'empaquet', 'perfect']",increibl servici rap bien empaquet perfect,positivo,positivo
pobre construcción materiales sin duda baratos frágil,negativo,"['pobr', 'construccion', 'material', 'dud', 'barat', 'fragil']",pobr construccion material dud barat fragil,negativo,negativo
aunque más completo algo aceptable realmente esperaba,neutro,"['aunqu', 'complet', 'acept', 'realment', 'esper']",aunqu complet acept realment esper,neutro,neutro
fantástico mejor volveré sin duda año definitivamente compra,positivo,"['fantast', 'mejor', 'volv', 'dud', 'año', 'definit', 'compr']",fantast mejor volv dud año definit compr,positivo,positivo
bien increíble rápido bastante perfecto servicio empaquetado,positivo,"['bien', 'increibl', 'rap', 'bastant', 'perfect', 'servici', 'empaquet']",bien increibl rap bastant perfect servici empaquet,positivo,positivo
realmente patético expectativas rendimiento defraudado bajo,negativo,"['realment', 'patet', 'expect', 'rendimient', 'defraud', 'baj']",realment patet expect rendimient defraud baj,negativo,negativo
construcción pobre materiales frágil baratos,negativo,"['construccion', 'pobr', 'material', 'fragil', 'barat']",construccion pobr material fragil barat,negativo,negativo
lujos sin básico sin duda funcional simple,neutro,"['luj', 'basic', 'dud', 'funcional', 'simpl']",luj basic dud funcional simpl,neutro,neutro
está ok malas tiene buenas cosas,neutro,"['mal', 'buen', 'cos']",mal buen cos,neutro,neutro
fácil rompe construcción endeble espantoso calidad,negativo,"['facil', 'romp', 'construccion', 'endebl', 'espant', 'calid']",facil romp construccion endebl espant calid,negativo,negativo
correcto pagado realmente precio razonable para,neutro,"['correct', 'pag', 'realment', 'preci', 'razon']",correct pag realment preci razon,neutro,neutro
cumple producto especial está muy bien nada,neutro,"['cumpl', 'product', 'especial', 'bien']",cumpl product especial bien,neutro,neutro
básico propósito extraordinario adecuado nada,neutro,"['basic', 'proposit', 'extraordinari', 'adecu']",basic proposit extraordinari adecu,neutro,neutro
ok malas completamente buenas está cosas tiene,neutro,"['mal', 'complet', 'buen', 'cos']",mal complet buen cos,neutro,neutro
destacable sin cumple descripción más,neutro,"['destac', 'cumpl', 'descripcion']",destac cumpl descripcion,neutro,neutro
básico nada propósito extraordinario adecuado,neutro,"['basic', 'proposit', 'extraordinari', 'adecu']",basic proposit extraordinari adecu,neutro,neutro
vida compra peor arrepentido nefasto,negativo,"['vid', 'compr', 'peor', 'arrepent', 'nefast']",vid compr peor arrepent nefast,negativo,negativo
genial perfectamente cumple funciones satisfecho,positivo,"['genial', 'perfect', 'cumpl', 'funcion', 'satisfech']",genial perfect cumpl funcion satisfech,positivo,positivo
solución uso problema perfecto diario brillante,positivo,"['solucion', 'uso', 'problem', 'perfect', 'diari', 'brillant']",solucion uso problem perfect diari brillant,positivo,positivo
muy superó compra satisfecho expectativas,positivo,"['super', 'compr', 'satisfech', 'expect']",super compr satisfech expect,positivo,positivo
fácil rompe construcción endeble bastante espantoso calidad,negativo,"['facil', 'romp', 'construccion', 'endebl', 'bastant', 'espant', 'calid']",facil romp construccion endebl bastant espant calid,negativo,negativo
promedio muy malo ni bueno ni,neutro,"['promedi', 'mal', 'buen']",promedi mal buen,neutro,neutro
regular calidad estándar mercado promedio,neutro,"['regul', 'calid', 'estand', 'merc', 'promedi']",regul calid estand merc promedi,neutro,neutro
impresionante nada común ordinario corriente,neutro,"['impresion', 'comun', 'ordinari', 'corrient']",impresion comun ordinari corrient,neutro,neutro
descripción feliz extraordinario supera muy compra,positivo,"['descripcion', 'feliz', 'extraordinari', 'super', 'compr']",descripcion feliz extraordinari super compr,positivo,positivo
malas está ok buenas cosas tiene,neutro,"['mal', 'buen', 'cos']",mal buen cos,neutro,neutro
pobre construcción frágil materiales baratos,negativo,"['pobr', 'construccion', 'fragil', 'material', 'barat']",pobr construccion fragil material barat,negativo,negativo
estándar mercado bastante calidad promedio regular,neutro,"['estand', 'merc', 'bastant', 'calid', 'promedi', 'regul']",estand merc bastant calid promedi regul,neutro,neutro
materiales pobre baratos construcción frágil,negativo,"['material', 'pobr', 'barat', 'construccion', 'fragil']",material pobr barat construccion fragil,negativo,negativo
simple lujos básico funcional sin,neutro,"['simpl', 'luj', 'basic', 'funcional']",simpl luj basic funcional,neutro,neutro
malísimo mal desde defectuoso sin duda inicio funciona,negativo,"['malisim', 'mal', 'defectu', 'dud', 'inici', 'funcion']",malisim mal defectu dud inici funcion,negativo,negativo
sin duda experiencia aquí más terrible nunca compraré,negativo,"['dud', 'experient', 'aqu', 'terribl', 'nunc', 'compr']",dud experient aqu terribl nunc compr,negativo,negativo
razonable precio correcto para pagado,neutro,"['razon', 'preci', 'correct', 'pag']",razon preci correct pag,neutro,neutro
completamente cumple sin destacable descripción más,neutro,"['complet', 'cumpl', 'destac', 'descripcion']",complet cumpl destac descripcion,neutro,neutro
básica normal cumple esperada función,neutro,"['basic', 'normal', 'cumpl', 'esper', 'funcion']",basic normal cumpl esper funcion,neutro,neutro
