texto,sentimiento,tokens,texto_procesado,prediccion_svm,prediccion_nb
producto premium magnífico excepcional muy calidad,positivo,"['product', 'premium', 'magnif', 'excepcional', 'calid']",product premium magnif excepcional calid,positivo,positivo
patético expectativas rendimiento defraudado bajo,negativo,"['patet', 'expect', 'rendimient', 'defraud', 'baj']",patet expect rendimient defraud baj,negativo,negativo
suficiente cubre mínimas aceptable necesidades,neutro,"['suficient', 'cubr', 'minim', 'acept', 'neces']",suficient cubr minim acept neces,neutro,neutro
sin funciona problemas decente particular,neutro,"['funcion', 'problem', 'decent', 'particul']",funcion problem decent particul,neutro,neutro
frágil construcción materiales baratos sin duda pobre,negativo,"['fragil', 'construccion', 'material', 'barat', 'dud', 'pobr']",fragil construccion material barat dud pobr,negativo,negativo
decepcionante publicidad cumple engañosa no promete,negativo,"['decepcion', 'public', 'cumpl', 'engañ', 'promet']",decepcion public cumpl engañ promet,negativo,negativo
aceptable suficiente mínimas cubre necesidades,neutro,"['acept', 'suficient', 'minim', 'cubr', 'neces']",acept suficient minim cubr neces,neutro,neutro
satisfecho superó expectativas compra muy,positivo,"['satisfech', 'super', 'expect', 'compr']",satisfech super expect compr,positivo,positivo
esperaba estrellas cinco totalmente exactamente perfecto,positivo,"['esper', 'estrell', 'cinc', 'total', 'exact', 'perfect']",esper estrell cinc total exact perfect,positivo,positivo
promedio muy bueno malo ni ni,neutro,"['promedi', 'buen', 'mal']",promedi buen mal,neutro,neutro
calidad precio totalmente recomiendo excelente producto,positivo,"['calid', 'preci', 'total', 'recom', 'excelent', 'product']",calid preci total recom excelent product,positivo,positivo
perfecto solución diario uso problema brillante,positivo,"['perfect', 'solucion', 'diari', 'uso', 'problem', 'brillant']",perfect solucion diari uso problem brillant,positivo,positivo
pobre frágil materiales construcción baratos,negativo,"['pobr', 'fragil', 'material', 'construccion', 'barat']",pobr fragil material construccion barat,negativo,negativo
razonable pagado precio correcto para,neutro,"['razon', 'pag', 'preci', 'correct']",razon pag preci correct,neutro,neutro
bueno confiable resistente duradero increíblemente,positivo,"['buen', 'confiabl', 'resistent', 'durader', 'increibl']",buen confiabl resistent durader increibl,positivo,positivo
realmente bueno increíblemente confiable resistente duradero,positivo,"['realment', 'buen', 'increibl', 'confiabl', 'resistent', 'durader']",realment buen increibl confiabl resistent durader,positivo,positivo
gama esperado mediano desempeño media,neutro,"['gam', 'esper', 'median', 'desempeñ', 'medi']",gam esper median desempeñ medi,neutro,neutro
no tiempo pérdida recomiendo dinero,negativo,"['tiemp', 'perd', 'recom', 'diner']",tiemp perd recom diner,negativo,negativo
premium magnífico producto excepcional calidad,positivo,"['premium', 'magnif', 'product', 'excepcional', 'calid']",premium magnif product excepcional calid,positivo,positivo
cliente absolutamente nulo atención servicio deplorable,negativo,"['client', 'absolut', 'nul', 'atencion', 'servici', 'deplor']",client absolut nul atencion servici deplor,negativo,negativo
aceptable muy algo aunque más completo esperaba,neutro,"['acept', 'aunqu', 'complet', 'esper']",acept aunqu complet esper,neutro,neutro
desempeño mediano esperado gama media,neutro,"['desempeñ', 'median', 'esper', 'gam', 'medi']",desempeñ median esper gam medi,neutro,neutro
desproporcionado calidad injusto inaceptable sin duda precio,negativo,"['desproporcion', 'calid', 'injust', 'inacept', 'dud', 'preci']",desproporcion calid injust inacept dud preci,negativo,negativo
genial perfectamente cumple funciones definitivamente satisfecho,positivo,"['genial', 'perfect', 'cumpl', 'funcion', 'definit', 'satisfech']",genial perfect cumpl funcion definit satisfech,positivo,positivo
construcción excelente completamente impresionante calidad durabilidad,positivo,"['construccion', 'excelent', 'complet', 'impresion', 'calid', 'durabil']",construccion excelent complet impresion calid durabil,positivo,positivo
malo llegó dañado tarde servicio horrible,negativo,"['mal', 'lleg', 'dañ', 'tard', 'servici', 'horribl']",mal lleg dañ tard servici horribl,negativo,negativo
lamentable caro mediocre producto sobrevalorado,negativo,"['lament', 'car', 'mediocr', 'product', 'sobrevalor']",lament car mediocr product sobrevalor,negativo,negativo
uso problema perfecto diario brillante solución,positivo,"['uso', 'problem', 'perfect', 'diari', 'brillant', 'solucion']",uso problem perfect diari brillant solucion,positivo,positivo
no sirve insatisfecho compra muy propósito,negativo,"['sirv', 'insatisfech', 'compr', 'proposit']",sirv insatisfech compr proposit,negativo,negativo
gama esperado mediano desempeño completamente media,neutro,"['gam', 'esper', 'median', 'desempeñ', 'complet', 'medi']",gam esper median desempeñ complet medi,neutro,neutro
promedio muy ni bueno ni malo,neutro,"['promedi', 'buen', 'mal']",promedi buen mal,neutro,neutro
producto caro lamentable mediocre sobrevalorado,negativo,"['product', 'car', 'lament', 'mediocr', 'sobrevalor']",product car lament mediocr sobrevalor,negativo,negativo
inseguro abominable absolutamente producto evitar peligroso,negativo,"['insegur', 'abomin', 'absolut', 'product', 'evit', 'peligr']",insegur abomin absolut product evit peligr,negativo,negativo
patético bajo defraudado rendimiento expectativas,negativo,"['patet', 'baj', 'defraud', 'rendimient', 'expect']",patet baj defraud rendimient expect,negativo,negativo
temporal pasable emergencia solución sirve,neutro,"['temporal', 'pasabl', 'emergent', 'solucion', 'sirv']",temporal pasabl emergent solucion sirv,neutro,neutro
hecho mal producto pésimo no funciona,negativo,"['hech', 'mal', 'product', 'pesim', 'funcion']",hech mal product pesim funcion,negativo,negativo
muy compra satisfecho expectativas superó,positivo,"['compr', 'satisfech', 'expect', 'super']",compr satisfech expect super,positivo,positivo
lamentable producto caro mediocre sobrevalorado,negativo,"['lament', 'product', 'car', 'mediocr', 'sobrevalor']",lament product car mediocr sobrevalor,negativo,negativo
cumple perfectamente funciones satisfecho genial,positivo,"['cumpl', 'perfect', 'funcion', 'satisfech', 'genial']",cumpl perfect funcion satisfech genial,positivo,positivo
temporal pasable completamente emergencia solución sirve,neutro,"['temporal', 'pasabl', 'complet', 'emergent', 'solucion', 'sirv']",temporal pasabl complet emergent solucion sirv,neutro,neutro
rápido increíble definitivamente perfecto servicio bien empaquetado,positivo,"['rap', 'increibl', 'definit', 'perfect', 'servici', 'bien', 'empaquet']",rap increibl definit perfect servici bien empaquet,positivo,positivo
estado perfecto buenísimo recomiendo tiempo llegó,positivo,"['perfect', 'buenisim', 'recom', 'tiemp', 'lleg']",perfect buenisim recom tiemp lleg,positivo,positivo
compra fantástico mejor año definitivamente volveré,positivo,"['compr', 'fantast', 'mejor', 'año', 'definit', 'volv']",compr fantast mejor año definit volv,positivo,positivo
totalmente desempeño esperado gama media mediano,neutro,"['total', 'desempeñ', 'esper', 'gam', 'medi', 'median']",total desempeñ esper gam medi median,neutro,neutro
lujos funcional simple básico sin,neutro,"['luj', 'funcional', 'simpl', 'basic']",luj funcional simpl basic,neutro,neutro
cumple perfectamente funciones genial satisfecho,positivo,"['cumpl', 'perfect', 'funcion', 'genial', 'satisfech']",cumpl perfect funcion genial satisfech,positivo,positivo
totalmente común ordinario corriente impresionante nada,neutro,"['total', 'comun', 'ordinari', 'corrient', 'impresion']",total comun ordinari corrient impresion,neutro,neutro
fantástico mejor volveré año bastante definitivamente compra,positivo,"['fantast', 'mejor', 'volv', 'año', 'bastant', 'definit', 'compr']",fantast mejor volv año bastant definit compr,positivo,positivo
esperada totalmente normal básica función cumple,neutro,"['esper', 'total', 'normal', 'basic', 'funcion', 'cumpl']",esper total normal basic funcion cumpl,neutro,neutro
básico extraordinario nada absolutamente adecuado propósito,neutro,"['basic', 'extraordinari', 'absolut', 'adecu', 'proposit']",basic extraordinari absolut adecu proposit,neutro,neutro
precio producto totalmente excelente recomiendo calidad,positivo,"['preci', 'product', 'total', 'excelent', 'recom', 'calid']",preci product total excelent recom calid,positivo,positivo
construcción frágil baratos materiales pobre,negativo,"['construccion', 'fragil', 'barat', 'material', 'pobr']",construccion fragil barat material pobr,negativo,negativo
realmente fácil endeble rompe espantoso construcción calidad,negativo,"['realment', 'facil', 'endebl', 'romp', 'espant', 'construccion', 'calid']",realment facil endebl romp espant construccion calid,negativo,negativo
malas buenas ok está tiene cosas,neutro,"['mal', 'buen', 'cos']",mal buen cos,neutro,neutro
fantástico año volveré compra mejor definitivamente,positivo,"['fantast', 'año', 'volv', 'compr', 'mejor', 'definit']",fantast año volv compr mejor definit,positivo,positivo
fraudulento imitación falsificado producto barata,negativo,"['fraudulent', 'imit', 'falsific', 'product', 'barat']",fraudulent imit falsific product barat,negativo,negativo
desempeño mediano esperado gama media,neutro,"['desempeñ', 'median', 'esper', 'gam', 'medi']",desempeñ median esper gam medi,neutro,neutro
común impresionante corriente nada ordinario,neutro,"['comun', 'impresion', 'corrient', 'ordinari']",comun impresion corrient ordinari,neutro,neutro
destacable descripción cumple sin más,neutro,"['destac', 'descripcion', 'cumpl']",destac descripcion cumpl,neutro,neutro
maravilloso inversión alta vale calidad completamente pena,positivo,"['maravill', 'inversion', 'alta', 'val', 'calid', 'complet', 'pen']",maravill inversion alta val calid complet pen,positivo,positivo
aceptable esperaba algo más sin duda completo aunque,neutro,"['acept', 'esper', 'dud', 'complet', 'aunqu']",acept esper dud complet aunqu,neutro,neutro
tiempo recomiendo dinero realmente pérdida no,negativo,"['tiemp', 'recom', 'diner', 'realment', 'perd']",tiemp recom diner realment perd,negativo,negativo
bajo definitivamente defraudado rendimiento patético expectativas,negativo,"['baj', 'definit', 'defraud', 'rendimient', 'patet', 'expect']",baj definit defraud rendimient patet expect,negativo,negativo
totalmente total nada estafa descripción horrible,negativo,"['total', 'total', 'estaf', 'descripcion', 'horribl']",total total estaf descripcion horribl,negativo,negativo
perfecto exactamente esperaba cinco estrellas,positivo,"['perfect', 'exact', 'esper', 'cinc', 'estrell']",perfect exact esper cinc estrell,positivo,positivo
producto está ciertamente bien nada especial cumple,neutro,"['product', 'ciert', 'bien', 'especial', 'cumpl']",product ciert bien especial cumpl,neutro,neutro
fantástico año volveré compra mejor definitivamente,positivo,"['fantast', 'año', 'volv', 'compr', 'mejor', 'definit']",fantast año volv compr mejor definit,positivo,positivo
muy satisfecho compra superó expectativas,positivo,"['satisfech', 'compr', 'super', 'expect']",satisfech compr super expect,positivo,positivo
lamentable caro mediocre producto sobrevalorado,negativo,"['lament', 'car', 'mediocr', 'product', 'sobrevalor']",lament car mediocr product sobrevalor,negativo,negativo
calidad insuperable precio relación estupendo,positivo,"['calid', 'insuper', 'preci', 'relacion', 'estupend']",calid insuper preci relacion estupend,positivo,positivo
calidad completamente inaceptable precio injusto desproporcionado,negativo,"['calid', 'complet', 'inacept', 'preci', 'injust', 'desproporcion']",calid complet inacept preci injust desproporcion,negativo,negativo
endeble construcción calidad espantoso bastante fácil rompe,negativo,"['endebl', 'construccion', 'calid', 'espant', 'bastant', 'facil', 'romp']",endebl construccion calid espant bastant facil romp,negativo,negativo
increíble servicio rápido bien empaquetado perfecto,positivo,"['increibl', 'servici', 'rap', 'bien', 'empaquet', 'perfect']",increibl servici rap bien empaquet perfect,positivo,positivo
opción sobresaliente mercado duda sin mejor,positivo,"['opcion', 'sobresalient', 'merc', 'dud', 'mejor']",opcion sobresalient merc dud mejor,positivo,positivo
no mal pésimo hecho funciona bastante producto,negativo,"['mal', 'pesim', 'hech', 'funcion', 'bastant', 'product']",mal pesim hech funcion bastant product,negativo,negativo
problema solución uso perfecto diario brillante,positivo,"['problem', 'solucion', 'uso', 'perfect', 'diari', 'brillant']",problem solucion uso perfect diari brillant,positivo,positivo
satisfecho funciones genial perfectamente cumple,positivo,"['satisfech', 'funcion', 'genial', 'perfect', 'cumpl']",satisfech funcion genial perfect cumpl,positivo,positivo
estrellas cinco completamente exactamente esperaba perfecto,positivo,"['estrell', 'cinc', 'complet', 'exact', 'esper', 'perfect']",estrell cinc complet exact esper perfect,positivo,positivo
compra muy extraordinario supera completamente descripción feliz,positivo,"['compr', 'extraordinari', 'super', 'complet', 'descripcion', 'feliz']",compr extraordinari super complet descripcion feliz,positivo,positivo
completamente expectativas rendimiento patético bajo defraudado,negativo,"['complet', 'expect', 'rendimient', 'patet', 'baj', 'defraud']",complet expect rendimient patet baj defraud,negativo,negativo
más algo muy completo aunque aceptable esperaba,neutro,"['complet', 'aunqu', 'acept', 'esper']",complet aunqu acept esper,neutro,neutro
total definitivamente nada estafa descripción horrible,negativo,"['total', 'definit', 'estaf', 'descripcion', 'horribl']",total definit estaf descripcion horribl,negativo,negativo
tiempo buenísimo recomiendo estado llegó perfecto,positivo,"['tiemp', 'buenisim', 'recom', 'lleg', 'perfect']",tiemp buenisim recom lleg perfect,positivo,positivo
duda opción mercado sobresaliente mejor sin,positivo,"['dud', 'opcion', 'merc', 'sobresalient', 'mejor']",dud opcion merc sobresalient mejor,positivo,positivo
gama esperado desempeño media mediano,neutro,"['gam', 'esper', 'desempeñ', 'medi', 'median']",gam esper desempeñ medi median,neutro,neutro
lujos simple básico sin funcional,neutro,"['luj', 'simpl', 'basic', 'funcional']",luj simpl basic funcional,neutro,neutro
inversión pena alta calidad maravilloso vale,positivo,"['inversion', 'pen', 'alta', 'calid', 'maravill', 'val']",inversion pen alta calid maravill val,positivo,positivo
mínimas cubre totalmente suficiente necesidades aceptable,neutro,"['minim', 'cubr', 'total', 'suficient', 'neces', 'acept']",minim cubr total suficient neces acept,neutro,neutro
cubre necesidades mínimas suficiente aceptable,neutro,"['cubr', 'neces', 'minim', 'suficient', 'acept']",cubr neces minim suficient acept,neutro,neutro
terrible aquí compraré nunca más experiencia,negativo,"['terribl', 'aqu', 'compr', 'nunc', 'experient']",terribl aqu compr nunc experient,negativo,negativo
barata fraudulento falsificado imitación producto,negativo,"['barat', 'fraudulent', 'falsific', 'imit', 'product']",barat fraudulent falsific imit product,negativo,negativo
llegó dañado tarde servicio horrible malo,negativo,"['lleg', 'dañ', 'tard', 'servici', 'horribl', 'mal']",lleg dañ tard servici horribl mal,negativo,negativo
promesas vendedor cumple honesto formidable,positivo,"['promes', 'vendedor', 'cumpl', 'honest', 'formid']",promes vendedor cumpl honest formid,positivo,positivo
nada estafa horrible descripción total,negativo,"['estaf', 'horribl', 'descripcion', 'total']",estaf horribl descripcion total,negativo,negativo
nada básico adecuado extraordinario propósito,neutro,"['basic', 'adecu', 'extraordinari', 'proposit']",basic adecu extraordinari proposit,neutro,neutro
dañado tarde llegó horrible servicio malo,negativo,"['dañ', 'tard', 'lleg', 'horribl', 'servici', 'mal']",dañ tard lleg horribl servici mal,negativo,negativo
terrible experiencia nunca más completamente compraré aquí,negativo,"['terribl', 'experient', 'nunc', 'complet', 'compr', 'aqu']",terribl experient nunc complet compr aqu,negativo,negativo
cumple normal realmente básica esperada función,neutro,"['cumpl', 'normal', 'realment', 'basic', 'esper', 'funcion']",cumpl normal realment basic esper funcion,neutro,neutro
horrible llegó servicio dañado malo tarde,negativo,"['horribl', 'lleg', 'servici', 'dañ', 'mal', 'tard']",horribl lleg servici dañ mal tard,negativo,negativo
peor definitivamente arrepentido vida compra nefasto,negativo,"['peor', 'definit', 'arrepent', 'vid', 'compr', 'nefast']",peor definit arrepent vid compr nefast,negativo,negativo
básico nada propósito extraordinario adecuado,neutro,"['basic', 'proposit', 'extraordinari', 'adecu']",basic proposit extraordinari adecu,neutro,neutro
dinero definitivamente no pérdida tiempo recomiendo,negativo,"['diner', 'definit', 'perd', 'tiemp', 'recom']",diner definit perd tiemp recom,negativo,negativo
estupendo ciertamente calidad relación precio insuperable,positivo,"['estupend', 'ciert', 'calid', 'relacion', 'preci', 'insuper']",estupend ciert calid relacion preci insuper,positivo,positivo
calidad relación precio estupendo insuperable,positivo,"['calid', 'relacion', 'preci', 'estupend', 'insuper']",calid relacion preci estupend insuper,positivo,positivo
horrible total nada descripción estafa,negativo,"['horribl', 'total', 'descripcion', 'estaf']",horribl total descripcion estaf,negativo,negativo
producto mediocre sobrevalorado completamente caro lamentable,negativo,"['product', 'mediocr', 'sobrevalor', 'complet', 'car', 'lament']",product mediocr sobrevalor complet car lament,negativo,negativo
calidad precio totalmente recomiendo excelente producto,positivo,"['calid', 'preci', 'total', 'recom', 'excelent', 'product']",calid preci total recom excelent product,positivo,positivo
desastroso inútil malo diseño incómodo,negativo,"['desastr', 'inutil', 'mal', 'diseñ', 'incomod']",desastr inutil mal diseñ incomod,negativo,negativo
común ordinario corriente impresionante nada,neutro,"['comun', 'ordinari', 'corrient', 'impresion']",comun ordinari corrient impresion,neutro,neutro
no promete publicidad decepcionante cumple engañosa,negativo,"['promet', 'public', 'decepcion', 'cumpl', 'engañ']",promet public decepcion cumpl engañ,negativo,negativo
temporal emergencia sirve ciertamente pasable solución,neutro,"['temporal', 'emergent', 'sirv', 'ciert', 'pasabl', 'solucion']",temporal emergent sirv ciert pasabl solucion,neutro,neutro
suficiente cubre realmente necesidades mínimas aceptable,neutro,"['suficient', 'cubr', 'realment', 'neces', 'minim', 'acept']",suficient cubr realment neces minim acept,neutro,neutro
precio estupendo relación insuperable calidad,positivo,"['preci', 'estupend', 'relacion', 'insuper', 'calid']",preci estupend relacion insuper calid,positivo,positivo
sin básico simple lujos funcional,neutro,"['basic', 'simpl', 'luj', 'funcional']",basic simpl luj funcional,neutro,neutro
muy expectativas satisfecho compra muy superó,positivo,"['expect', 'satisfech', 'compr', 'super']",expect satisfech compr super,positivo,positivo
diseño funcional fabuloso elegante práctico,positivo,"['diseñ', 'funcional', 'fabul', 'eleg', 'practic']",diseñ funcional fabul eleg practic,positivo,positivo
esperada ciertamente cumple función básica normal,neutro,"['esper', 'ciert', 'cumpl', 'funcion', 'basic', 'normal']",esper ciert cumpl funcion basic normal,neutro,neutro
hecho funciona pésimo muy no mal producto,negativo,"['hech', 'funcion', 'pesim', 'mal', 'product']",hech funcion pesim mal product,negativo,negativo
sin decente problemas particular funciona,neutro,"['decent', 'problem', 'particul', 'funcion']",decent problem particul funcion,neutro,neutro
defectuoso malísimo desde muy inicio funciona mal,negativo,"['defectu', 'malisim', 'inici', 'funcion', 'mal']",defectu malisim inici funcion mal,negativo,negativo
cumple no decepcionante ciertamente publicidad promete engañosa,negativo,"['cumpl', 'decepcion', 'ciert', 'public', 'promet', 'engañ']",cumpl decepcion ciert public promet engañ,negativo,negativo
fácil rompe construcción endeble espantoso calidad,negativo,"['facil', 'romp', 'construccion', 'endebl', 'espant', 'calid']",facil romp construccion endebl espant calid,negativo,negativo
impresionante nada común ordinario corriente,neutro,"['impresion', 'comun', 'ordinari', 'corrient']",impresion comun ordinari corrient,neutro,neutro
excelente producto definitivamente calidad precio recomiendo totalmente,positivo,"['excelent', 'product', 'definit', 'calid', 'preci', 'recom', 'total']",excelent product definit calid preci recom total,positivo,positivo
inútil completamente malo diseño incómodo desastroso,negativo,"['inutil', 'complet', 'mal', 'diseñ', 'incomod', 'desastr']",inutil complet mal diseñ incomod desastr,negativo,negativo
magnífico calidad excepcional producto premium,positivo,"['magnif', 'calid', 'excepcional', 'product', 'premium']",magnif calid excepcional product premium,positivo,positivo
funcional lujos simple sin básico,neutro,"['funcional', 'luj', 'simpl', 'basic']",funcional luj simpl basic,neutro,neutro
ciertamente calidad regular mercado promedio estándar,neutro,"['ciert', 'calid', 'regul', 'merc', 'promedi', 'estand']",ciert calid regul merc promedi estand,neutro,neutro
propósito compra insatisfecho muy sirve absolutamente no,negativo,"['proposit', 'compr', 'insatisfech', 'sirv', 'absolut']",proposit compr insatisfech sirv absolut,negativo,negativo
precio relación insuperable calidad estupendo,positivo,"['preci', 'relacion', 'insuper', 'calid', 'estupend']",preci relacion insuper calid estupend,positivo,positivo
vida nefasto peor arrepentido compra,negativo,"['vid', 'nefast', 'peor', 'arrepent', 'compr']",vid nefast peor arrepent compr,negativo,negativo
impresionante nada común ordinario sin duda corriente,neutro,"['impresion', 'comun', 'ordinari', 'dud', 'corrient']",impresion comun ordinari dud corrient,neutro,neutro
deficiente esperado calidad inferior basura,negativo,"['deficient', 'esper', 'calid', 'inferior', 'basur']",deficient esper calid inferior basur,negativo,negativo
destacable más cumple descripción sin,neutro,"['destac', 'cumpl', 'descripcion']",destac cumpl descripcion,neutro,neutro
básica absolutamente esperada normal cumple función,neutro,"['basic', 'absolut', 'esper', 'normal', 'cumpl', 'funcion']",basic absolut esper normal cumpl funcion,neutro,neutro
genial satisfecho perfectamente funciones cumple,positivo,"['genial', 'satisfech', 'perfect', 'funcion', 'cumpl']",genial satisfech perfect funcion cumpl,positivo,positivo
esperaba más aceptable algo completo aunque,neutro,"['esper', 'acept', 'complet', 'aunqu']",esper acept complet aunqu,neutro,neutro
cubre suficiente aceptable totalmente necesidades mínimas,neutro,"['cubr', 'suficient', 'acept', 'total', 'neces', 'minim']",cubr suficient acept total neces minim,neutro,neutro
producto está bien nada especial cumple,neutro,"['product', 'bien', 'especial', 'cumpl']",product bien especial cumpl,neutro,neutro
bastante ordinario impresionante corriente nada común,neutro,"['bastant', 'ordinari', 'impresion', 'corrient', 'comun']",bastant ordinari impresion corrient comun,neutro,neutro
construcción ciertamente calidad impresionante excelente durabilidad,positivo,"['construccion', 'ciert', 'calid', 'impresion', 'excelent', 'durabil']",construccion ciert calid impresion excelent durabil,positivo,positivo
sin decente problemas particular funciona,neutro,"['decent', 'problem', 'particul', 'funcion']",decent problem particul funcion,neutro,neutro
muy hecho pésimo producto funciona mal no,negativo,"['hech', 'pesim', 'product', 'funcion', 'mal']",hech pesim product funcion mal,negativo,negativo
perfecto esperaba cinco exactamente estrellas,positivo,"['perfect', 'esper', 'cinc', 'exact', 'estrell']",perfect esper cinc exact estrell,positivo,positivo
muy insatisfecho compra no sirve propósito,negativo,"['insatisfech', 'compr', 'sirv', 'proposit']",insatisfech compr sirv proposit,negativo,negativo
fácil calidad rompe construcción endeble bastante espantoso,negativo,"['facil', 'calid', 'romp', 'construccion', 'endebl', 'bastant', 'espant']",facil calid romp construccion endebl bastant espant,negativo,negativo
esperada absolutamente normal función básica cumple,neutro,"['esper', 'absolut', 'normal', 'funcion', 'basic', 'cumpl']",esper absolut normal funcion basic cumpl,neutro,neutro
brillante solución problema perfecto uso diario,positivo,"['brillant', 'solucion', 'problem', 'perfect', 'uso', 'diari']",brillant solucion problem perfect uso diari,positivo,positivo
rendimiento defraudado expectativas patético bajo,negativo,"['rendimient', 'defraud', 'expect', 'patet', 'baj']",rendimient defraud expect patet baj,negativo,negativo
funciona inicio desde bastante malísimo mal defectuoso,negativo,"['funcion', 'inici', 'bastant', 'malisim', 'mal', 'defectu']",funcion inici bastant malisim mal defectu,negativo,negativo
tiene está buenas cosas malas ok,neutro,"['buen', 'cos', 'mal']",buen cos mal,neutro,neutro
perfecto tiempo recomiendo buenísimo llegó estado,positivo,"['perfect', 'tiemp', 'recom', 'buenisim', 'lleg']",perfect tiemp recom buenisim lleg,positivo,positivo
uso solución brillante problema perfecto diario,positivo,"['uso', 'solucion', 'brillant', 'problem', 'perfect', 'diari']",uso solucion brillant problem perfect diari,positivo,positivo
sirve temporal pasable definitivamente emergencia solución,neutro,"['sirv', 'temporal', 'pasabl', 'definit', 'emergent', 'solucion']",sirv temporal pasabl definit emergent solucion,neutro,neutro
