texto,sentimiento,tokens,texto_procesado,prediccion_svm,prediccion_nb
rompe endeble construcción espantoso fácil calidad,negativo,"['romp', 'endebl', 'construccion', 'espant', 'facil', 'calid']",romp endebl construccion espant facil calid,negativo,negativo
destacable más totalmente sin descripción cumple,neutro,"['destac', 'total', 'descripcion', 'cumpl']",destac total descripcion cumpl,neutro,neutro
construcción endeble espantoso fácil rompe calidad,negativo,"['construccion', 'endebl', 'espant', 'facil', 'romp', 'calid']",construccion endebl espant facil romp calid,negativo,negativo
vida nefasto peor arrepentido compra,negativo,"['vid', 'nefast', 'peor', 'arrepent', 'compr']",vid nefast peor arrepent compr,negativo,negativo
horrible nada descripción estafa total,negativo,"['horribl', 'descripcion', 'estaf', 'total']",horribl descripcion estaf total,negativo,negativo
materiales baratos pobre frágil definitivamente construcción,negativo,"['material', 'barat', 'pobr', 'fragil', 'definit', 'construccion']",material barat pobr fragil definit construccion,negativo,negativo
opción sin mejor sobresaliente duda mercado,positivo,"['opcion', 'mejor', 'sobresalient', 'dud', 'merc']",opcion mejor sobresalient dud merc,positivo,positivo
común impresionante corriente nada bastante ordinario,neutro,"['comun', 'impresion', 'corrient', 'bastant', 'ordinari']",comun impresion corrient bastant ordinari,neutro,neutro
malísimo inicio defectuoso desde mal muy funciona,negativo,"['malisim', 'inici', 'defectu', 'mal', 'funcion']",malisim inici defectu mal funcion,negativo,negativo
bien increíble rápido perfecto servicio empaquetado,positivo,"['bien', 'increibl', 'rap', 'perfect', 'servici', 'empaquet']",bien increibl rap perfect servici empaquet,positivo,positivo
ciertamente ni muy bueno ni malo promedio,neutro,"['ciert', 'buen', 'mal', 'promedi']",ciert buen mal promedi,neutro,neutro
experiencia compraré nunca terrible aquí más,negativo,"['experient', 'compr', 'nunc', 'terribl', 'aqu']",experient compr nunc terribl aqu,negativo,negativo
para precio pagado correcto razonable,neutro,"['preci', 'pag', 'correct', 'razon']",preci pag correct razon,neutro,neutro
vale alta calidad pena inversión maravilloso,positivo,"['val', 'alta', 'calid', 'pen', 'inversion', 'maravill']",val alta calid pen inversion maravill,positivo,positivo
expectativas muy compra superó satisfecho,positivo,"['expect', 'compr', 'super', 'satisfech']",expect compr super satisfech,positivo,positivo
totalmente calidad regular mercado promedio estándar,neutro,"['total', 'calid', 'regul', 'merc', 'promedi', 'estand']",total calid regul merc promedi estand,neutro,neutro
esperada cumple función básica absolutamente normal,neutro,"['esper', 'cumpl', 'funcion', 'basic', 'absolut', 'normal']",esper cumpl funcion basic absolut normal,neutro,neutro
completo esperaba absolutamente aunque algo aceptable más,neutro,"['complet', 'esper', 'absolut', 'aunqu', 'acept']",complet esper absolut aunqu acept,neutro,neutro
perfecto completamente esperaba cinco exactamente estrellas,positivo,"['perfect', 'complet', 'esper', 'cinc', 'exact', 'estrell']",perfect complet esper cinc exact estrell,positivo,positivo
increíble empaquetado perfecto bien servicio rápido,positivo,"['increibl', 'empaquet', 'perfect', 'bien', 'servici', 'rap']",increibl empaquet perfect bien servici rap,positivo,positivo
básica esperada normal función cumple,neutro,"['basic', 'esper', 'normal', 'funcion', 'cumpl']",basic esper normal funcion cumpl,neutro,neutro
malo llegó dañado tarde servicio horrible,negativo,"['mal', 'lleg', 'dañ', 'tard', 'servici', 'horribl']",mal lleg dañ tard servici horribl,negativo,negativo
problemas particular funciona sin decente,neutro,"['problem', 'particul', 'funcion', 'decent']",problem particul funcion decent,neutro,neutro
fácil endeble rompe espantoso construcción calidad,negativo,"['facil', 'endebl', 'romp', 'espant', 'construccion', 'calid']",facil endebl romp espant construccion calid,negativo,negativo
razonable para correcto pagado precio,neutro,"['razon', 'correct', 'pag', 'preci']",razon correct pag preci,neutro,neutro
bueno ni malo muy ni promedio,neutro,"['buen', 'mal', 'promedi']",buen mal promedi,neutro,neutro
básica normal sin duda cumple esperada función,neutro,"['basic', 'normal', 'dud', 'cumpl', 'esper', 'funcion']",basic normal dud cumpl esper funcion,neutro,neutro
extraordinario supera feliz descripción muy compra,positivo,"['extraordinari', 'super', 'feliz', 'descripcion', 'compr']",extraordinari super feliz descripcion compr,positivo,positivo
bastante deplorable cliente servicio nulo atención,negativo,"['bastant', 'deplor', 'client', 'servici', 'nul', 'atencion']",bastant deplor client servici nul atencion,negativo,negativo
gama esperado mediano desempeño media,neutro,"['gam', 'esper', 'median', 'desempeñ', 'medi']",gam esper median desempeñ medi,neutro,neutro
ni muy bueno ni malo promedio,neutro,"['buen', 'mal', 'promedi']",buen mal promedi,neutro,neutro
para correcto pagado razonable precio,neutro,"['correct', 'pag', 'razon', 'preci']",correct pag razon preci,neutro,neutro
peor arrepentido vida compra nefasto,negativo,"['peor', 'arrepent', 'vid', 'compr', 'nefast']",peor arrepent vid compr nefast,negativo,negativo
resistente ciertamente increíblemente confiable bueno duradero,positivo,"['resistent', 'ciert', 'increibl', 'confiabl', 'buen', 'durader']",resistent ciert increibl confiabl buen durader,positivo,positivo
desproporcionado calidad injusto inaceptable precio,negativo,"['desproporcion', 'calid', 'injust', 'inacept', 'preci']",desproporcion calid injust inacept preci,negativo,negativo
no hecho pésimo producto mal funciona,negativo,"['hech', 'pesim', 'product', 'mal', 'funcion']",hech pesim product mal funcion,negativo,negativo
no pésimo funciona producto hecho mal,negativo,"['pesim', 'funcion', 'product', 'hech', 'mal']",pesim funcion product hech mal,negativo,negativo
sensacional recomiendo ampliamente mejor hecho inversión,positivo,"['sensacional', 'recom', 'ampli', 'mejor', 'hech', 'inversion']",sensacional recom ampli mejor hech inversion,positivo,positivo
descripción horrible estafa nada absolutamente total,negativo,"['descripcion', 'horribl', 'estaf', 'absolut', 'total']",descripcion horribl estaf absolut total,negativo,negativo
malas está ok buenas cosas tiene,neutro,"['mal', 'buen', 'cos']",mal buen cos,neutro,neutro
justo buscaba contento espectacular muy,positivo,"['just', 'busc', 'content', 'espectacul']",just busc content espectacul,positivo,positivo
función normal básica esperada cumple,neutro,"['funcion', 'normal', 'basic', 'esper', 'cumpl']",funcion normal basic esper cumpl,neutro,neutro
excelente producto totalmente calidad precio recomiendo,positivo,"['excelent', 'product', 'total', 'calid', 'preci', 'recom']",excelent product total calid preci recom,positivo,positivo
supera muy compra extraordinario feliz descripción,positivo,"['super', 'compr', 'extraordinari', 'feliz', 'descripcion']",super compr extraordinari feliz descripcion,positivo,positivo
muy esperaba exactamente estrellas cinco perfecto,positivo,"['esper', 'exact', 'estrell', 'cinc', 'perfect']",esper exact estrell cinc perfect,positivo,positivo
problema solución uso perfecto diario brillante,positivo,"['problem', 'solucion', 'uso', 'perfect', 'diari', 'brillant']",problem solucion uso perfect diari brillant,positivo,positivo
ciertamente expectativas superó muy satisfecho compra,positivo,"['ciert', 'expect', 'super', 'satisfech', 'compr']",ciert expect super satisfech compr,positivo,positivo
sin sobresaliente duda mercado opción mejor,positivo,"['sobresalient', 'dud', 'merc', 'opcion', 'mejor']",sobresalient dud merc opcion mejor,positivo,positivo
bastante recomiendo perfecto buenísimo llegó tiempo estado,positivo,"['bastant', 'recom', 'perfect', 'buenisim', 'lleg', 'tiemp']",bastant recom perfect buenisim lleg tiemp,positivo,positivo
sin funcional simple básico lujos,neutro,"['funcional', 'simpl', 'basic', 'luj']",funcional simpl basic luj,neutro,neutro
dañado horrible llegó tarde malo servicio,negativo,"['dañ', 'horribl', 'lleg', 'tard', 'mal', 'servici']",dañ horribl lleg tard mal servici,negativo,negativo
mínimas cubre suficiente bastante necesidades aceptable,neutro,"['minim', 'cubr', 'suficient', 'bastant', 'neces', 'acept']",minim cubr suficient bastant neces acept,neutro,neutro
duda opción mejor sin mercado sobresaliente,positivo,"['dud', 'opcion', 'mejor', 'merc', 'sobresalient']",dud opcion mejor merc sobresalient,positivo,positivo
producto especial nada bien está cumple,neutro,"['product', 'especial', 'bien', 'cumpl']",product especial bien cumpl,neutro,neutro
definitivamente horrible llegó servicio dañado malo tarde,negativo,"['definit', 'horribl', 'lleg', 'servici', 'dañ', 'mal', 'tard']",definit horribl lleg servici dañ mal tard,negativo,negativo
hecho mal producto pésimo no funciona,negativo,"['hech', 'mal', 'product', 'pesim', 'funcion']",hech mal product pesim funcion,negativo,negativo
buenísimo estado definitivamente llegó recomiendo tiempo perfecto,positivo,"['buenisim', 'definit', 'lleg', 'recom', 'tiemp', 'perfect']",buenisim definit lleg recom tiemp perfect,positivo,positivo
calidad totalmente producto completamente precio recomiendo excelente,positivo,"['calid', 'total', 'product', 'complet', 'preci', 'recom', 'excelent']",calid total product complet preci recom excelent,positivo,positivo
realmente perfecto increíble servicio empaquetado bien rápido,positivo,"['realment', 'perfect', 'increibl', 'servici', 'empaquet', 'bien', 'rap']",realment perfect increibl servici empaquet bien rap,positivo,positivo
mala decepcionante rompió uso primer calidad muy,negativo,"['mal', 'decepcion', 'romp', 'uso', 'prim', 'calid']",mal decepcion romp uso prim calid,negativo,negativo
pérdida recomiendo dinero tiempo no,negativo,"['perd', 'recom', 'diner', 'tiemp']",perd recom diner tiemp,negativo,negativo
destacable cumple sin totalmente más descripción,neutro,"['destac', 'cumpl', 'total', 'descripcion']",destac cumpl total descripcion,neutro,neutro
desastroso incómodo inútil diseño malo,negativo,"['desastr', 'incomod', 'inutil', 'diseñ', 'mal']",desastr incomod inutil diseñ mal,negativo,negativo
compra vida arrepentido nefasto peor,negativo,"['compr', 'vid', 'arrepent', 'nefast', 'peor']",compr vid arrepent nefast peor,negativo,negativo
no recomiendo pérdida dinero tiempo,negativo,"['recom', 'perd', 'diner', 'tiemp']",recom perd diner tiemp,negativo,negativo
fácil muy rompe construcción endeble espantoso calidad,negativo,"['facil', 'romp', 'construccion', 'endebl', 'espant', 'calid']",facil romp construccion endebl espant calid,negativo,negativo
esperaba exactamente estrellas cinco completamente perfecto,positivo,"['esper', 'exact', 'estrell', 'cinc', 'complet', 'perfect']",esper exact estrell cinc complet perfect,positivo,positivo
no sirve compra muy insatisfecho propósito,negativo,"['sirv', 'compr', 'insatisfech', 'proposit']",sirv compr insatisfech proposit,negativo,negativo
aceptable necesidades mínimas suficiente cubre,neutro,"['acept', 'neces', 'minim', 'suficient', 'cubr']",acept neces minim suficient cubr,neutro,neutro
opción ciertamente duda sobresaliente sin mercado mejor,positivo,"['opcion', 'ciert', 'dud', 'sobresalient', 'merc', 'mejor']",opcion ciert dud sobresalient merc mejor,positivo,positivo
malísimo mal desde defectuoso inicio definitivamente funciona,negativo,"['malisim', 'mal', 'defectu', 'inici', 'definit', 'funcion']",malisim mal defectu inici definit funcion,negativo,negativo
destacable más cumple definitivamente descripción sin,neutro,"['destac', 'cumpl', 'definit', 'descripcion']",destac cumpl definit descripcion,neutro,neutro
superó expectativas muy compra satisfecho,positivo,"['super', 'expect', 'compr', 'satisfech']",super expect compr satisfech,positivo,positivo
sirve pasable emergencia temporal solución,neutro,"['sirv', 'pasabl', 'emergent', 'temporal', 'solucion']",sirv pasabl emergent temporal solucion,neutro,neutro
práctico fabuloso funcional elegante diseño,positivo,"['practic', 'fabul', 'funcional', 'eleg', 'diseñ']",practic fabul funcional eleg diseñ,positivo,positivo
expectativas satisfecho compra muy superó,positivo,"['expect', 'satisfech', 'compr', 'super']",expect satisfech compr super,positivo,positivo
diseño elegante práctico funcional fabuloso,positivo,"['diseñ', 'eleg', 'practic', 'funcional', 'fabul']",diseñ eleg practic funcional fabul,positivo,positivo
defraudado rendimiento expectativas patético bajo,negativo,"['defraud', 'rendimient', 'expect', 'patet', 'baj']",defraud rendimient expect patet baj,negativo,negativo
satisfecho funciones cumple genial absolutamente perfectamente,positivo,"['satisfech', 'funcion', 'cumpl', 'genial', 'absolut', 'perfect']",satisfech funcion cumpl genial absolut perfect,positivo,positivo
realmente falsificado imitación barata producto fraudulento,negativo,"['realment', 'falsific', 'imit', 'barat', 'product', 'fraudulent']",realment falsific imit barat product fraudulent,negativo,negativo
contento espectacular muy buscaba justo muy,positivo,"['content', 'espectacul', 'busc', 'just']",content espectacul busc just,positivo,positivo
sensacional mejor ampliamente inversión hecho completamente recomiendo,positivo,"['sensacional', 'mejor', 'ampli', 'inversion', 'hech', 'complet', 'recom']",sensacional mejor ampli inversion hech complet recom,positivo,positivo
inseguro abominable realmente producto evitar peligroso,negativo,"['insegur', 'abomin', 'realment', 'product', 'evit', 'peligr']",insegur abomin realment product evit peligr,negativo,negativo
calidad construcción espantoso fácil endeble rompe,negativo,"['calid', 'construccion', 'espant', 'facil', 'endebl', 'romp']",calid construccion espant facil endebl romp,negativo,negativo
ni malo muy ciertamente promedio ni bueno,neutro,"['mal', 'ciert', 'promedi', 'buen']",mal ciert promedi buen,neutro,neutro
precio completamente estupendo calidad relación insuperable,positivo,"['preci', 'complet', 'estupend', 'calid', 'relacion', 'insuper']",preci complet estupend calid relacion insuper,positivo,positivo
esperaba más algo aunque aceptable muy completo,neutro,"['esper', 'aunqu', 'acept', 'complet']",esper aunqu acept complet,neutro,neutro
cubre totalmente mínimas aceptable necesidades suficiente,neutro,"['cubr', 'total', 'minim', 'acept', 'neces', 'suficient']",cubr total minim acept neces suficient,neutro,neutro
recomiendo excelente producto calidad totalmente precio,positivo,"['recom', 'excelent', 'product', 'calid', 'total', 'preci']",recom excelent product calid total preci,positivo,positivo
aunque algo esperaba más aceptable absolutamente completo,neutro,"['aunqu', 'esper', 'acept', 'absolut', 'complet']",aunqu esper acept absolut complet,neutro,neutro
maravilloso inversión alta vale calidad pena,positivo,"['maravill', 'inversion', 'alta', 'val', 'calid', 'pen']",maravill inversion alta val calid pen,positivo,positivo
mal desde defectuoso funciona malísimo inicio,negativo,"['mal', 'defectu', 'funcion', 'malisim', 'inici']",mal defectu funcion malisim inici,negativo,negativo
esperada normal función básica cumple,neutro,"['esper', 'normal', 'funcion', 'basic', 'cumpl']",esper normal funcion basic cumpl,neutro,neutro
totalmente expectativas muy compra superó satisfecho,positivo,"['total', 'expect', 'compr', 'super', 'satisfech']",total expect compr super satisfech,positivo,positivo
bajo patético expectativas defraudado rendimiento,negativo,"['baj', 'patet', 'expect', 'defraud', 'rendimient']",baj patet expect defraud rendimient,negativo,negativo
destacable descripción cumple sin más,neutro,"['destac', 'descripcion', 'cumpl']",destac descripcion cumpl,neutro,neutro
tiene está buenas cosas malas ok,neutro,"['buen', 'cos', 'mal']",buen cos mal,neutro,neutro
rápido increíble perfecto muy servicio bien empaquetado,positivo,"['rap', 'increibl', 'perfect', 'servici', 'bien', 'empaquet']",rap increibl perfect servici bien empaquet,positivo,positivo
precio calidad relación completamente estupendo insuperable,positivo,"['preci', 'calid', 'relacion', 'complet', 'estupend', 'insuper']",preci calid relacion complet estupend insuper,positivo,positivo
esperaba más completo aunque algo aceptable,neutro,"['esper', 'complet', 'aunqu', 'acept']",esper complet aunqu acept,neutro,neutro
muy básica esperada normal función cumple,neutro,"['basic', 'esper', 'normal', 'funcion', 'cumpl']",basic esper normal funcion cumpl,neutro,neutro
insuperable sin duda estupendo relación precio calidad,positivo,"['insuper', 'dud', 'estupend', 'relacion', 'preci', 'calid']",insuper dud estupend relacion preci calid,positivo,positivo
perfecto estrellas cinco bastante esperaba exactamente,positivo,"['perfect', 'estrell', 'cinc', 'bastant', 'esper', 'exact']",perfect estrell cinc bastant esper exact,positivo,positivo
funciona hecho pésimo producto mal no,negativo,"['funcion', 'hech', 'pesim', 'product', 'mal']",funcion hech pesim product mal,negativo,negativo
ni promedio muy malo ni bueno,neutro,"['promedi', 'mal', 'buen']",promedi mal buen,neutro,neutro
compra mejor año volveré definitivamente fantástico,positivo,"['compr', 'mejor', 'año', 'volv', 'definit', 'fantast']",compr mejor año volv definit fantast,positivo,positivo
inversión pena alta calidad maravilloso vale,positivo,"['inversion', 'pen', 'alta', 'calid', 'maravill', 'val']",inversion pen alta calid maravill val,positivo,positivo
nada estafa horrible descripción total,negativo,"['estaf', 'horribl', 'descripcion', 'total']",estaf horribl descripcion total,negativo,negativo
producto nada está cumple bien especial,neutro,"['product', 'cumpl', 'bien', 'especial']",product cumpl bien especial,neutro,neutro
excepcional totalmente magnífico producto calidad premium,positivo,"['excepcional', 'total', 'magnif', 'product', 'calid', 'premium']",excepcional total magnif product calid premium,positivo,positivo
esperado calidad basura inferior deficiente,negativo,"['esper', 'calid', 'basur', 'inferior', 'deficient']",esper calid basur inferior deficient,negativo,negativo
aceptable algo aunque más absolutamente completo esperaba,neutro,"['acept', 'aunqu', 'absolut', 'complet', 'esper']",acept aunqu absolut complet esper,neutro,neutro
horrible total sin duda nada estafa descripción,negativo,"['horribl', 'total', 'dud', 'estaf', 'descripcion']",horribl total dud estaf descripcion,negativo,negativo
común impresionante nada ordinario corriente,neutro,"['comun', 'impresion', 'ordinari', 'corrient']",comun impresion ordinari corrient,neutro,neutro
aceptable algo aunque más completo esperaba,neutro,"['acept', 'aunqu', 'complet', 'esper']",acept aunqu complet esper,neutro,neutro
producto ciertamente premium magnífico excepcional calidad,positivo,"['product', 'ciert', 'premium', 'magnif', 'excepcional', 'calid']",product ciert premium magnif excepcional calid,positivo,positivo
básica cumple esperada función normal,neutro,"['basic', 'cumpl', 'esper', 'funcion', 'normal']",basic cumpl esper funcion normal,neutro,neutro
durabilidad calidad excelente construcción impresionante,positivo,"['durabil', 'calid', 'excelent', 'construccion', 'impresion']",durabil calid excelent construccion impresion,positivo,positivo
pagado para razonable correcto precio,neutro,"['pag', 'razon', 'correct', 'preci']",pag razon correct preci,neutro,neutro
pasable temporal solución sirve absolutamente emergencia,neutro,"['pasabl', 'temporal', 'solucion', 'sirv', 'absolut', 'emergent']",pasabl temporal solucion sirv absolut emergent,neutro,neutro
inútil definitivamente malo desastroso incómodo diseño,negativo,"['inutil', 'definit', 'mal', 'desastr', 'incomod', 'diseñ']",inutil definit mal desastr incomod diseñ,negativo,negativo
insuperable calidad precio relación estupendo,positivo,"['insuper', 'calid', 'preci', 'relacion', 'estupend']",insuper calid preci relacion estupend,positivo,positivo
buscaba espectacular muy justo contento,positivo,"['busc', 'espectacul', 'just', 'content']",busc espectacul just content,positivo,positivo
vale alta calidad pena inversión maravilloso,positivo,"['val', 'alta', 'calid', 'pen', 'inversion', 'maravill']",val alta calid pen inversion maravill,positivo,positivo
aceptable necesidades mínimas suficiente cubre,neutro,"['acept', 'neces', 'minim', 'suficient', 'cubr']",acept neces minim suficient cubr,neutro,neutro
rompe calidad endeble construcción espantoso fácil,negativo,"['romp', 'calid', 'endebl', 'construccion', 'espant', 'facil']",romp calid endebl construccion espant facil,negativo,negativo
genial satisfecho perfectamente funciones cumple,positivo,"['genial', 'satisfech', 'perfect', 'funcion', 'cumpl']",genial satisfech perfect funcion cumpl,positivo,positivo
totalmente precio relación insuperable calidad estupendo,positivo,"['total', 'preci', 'relacion', 'insuper', 'calid', 'estupend']",total preci relacion insuper calid estupend,positivo,positivo
aceptable esperaba aunque más completo algo,neutro,"['acept', 'esper', 'aunqu', 'complet']",acept esper aunqu complet,neutro,neutro
producto premium magnífico excepcional calidad,positivo,"['product', 'premium', 'magnif', 'excepcional', 'calid']",product premium magnif excepcional calid,positivo,positivo
práctico fabuloso funcional elegante muy diseño,positivo,"['practic', 'fabul', 'funcional', 'eleg', 'diseñ']",practic fabul funcional eleg diseñ,positivo,positivo
inversión pena alta calidad maravilloso vale,positivo,"['inversion', 'pen', 'alta', 'calid', 'maravill', 'val']",inversion pen alta calid maravill val,positivo,positivo
buenas ok está cosas tiene malas,neutro,"['buen', 'cos', 'mal']",buen cos mal,neutro,neutro
bastante lamentable producto caro mediocre sobrevalorado,negativo,"['bastant', 'lament', 'product', 'car', 'mediocr', 'sobrevalor']",bastant lament product car mediocr sobrevalor,negativo,negativo
aceptable algo aunque más completo esperaba,neutro,"['acept', 'aunqu', 'complet', 'esper']",acept aunqu complet esper,neutro,neutro
esperada básica cumple función normal,neutro,"['esper', 'basic', 'cumpl', 'funcion', 'normal']",esper basic cumpl funcion normal,neutro,neutro
aceptable necesidades ciertamente cubre suficiente mínimas,neutro,"['acept', 'neces', 'ciert', 'cubr', 'suficient', 'minim']",acept neces ciert cubr suficient minim,neutro,neutro
mediano gama desempeño ciertamente media esperado,neutro,"['median', 'gam', 'desempeñ', 'ciert', 'medi', 'esper']",median gam desempeñ ciert medi esper,neutro,neutro
muy solución sirve temporal emergencia pasable,neutro,"['solucion', 'sirv', 'temporal', 'emergent', 'pasabl']",solucion sirv temporal emergent pasabl,neutro,neutro
absolutamente excepcional magnífico producto calidad premium,positivo,"['absolut', 'excepcional', 'magnif', 'product', 'calid', 'premium']",absolut excepcional magnif product calid premium,positivo,positivo
realmente funciona inicio desde malísimo mal defectuoso,negativo,"['realment', 'funcion', 'inici', 'malisim', 'mal', 'defectu']",realment funcion inici malisim mal defectu,negativo,negativo
problema perfecto solución diario uso absolutamente brillante,positivo,"['problem', 'perfect', 'solucion', 'diari', 'uso', 'absolut', 'brillant']",problem perfect solucion diari uso absolut brillant,positivo,positivo
correcto para precio pagado razonable,neutro,"['correct', 'preci', 'pag', 'razon']",correct preci pag razon,neutro,neutro
aceptable mínimas necesidades sin duda suficiente cubre,neutro,"['acept', 'minim', 'neces', 'dud', 'suficient', 'cubr']",acept minim neces dud suficient cubr,neutro,neutro
cumple producto especial está bien nada,neutro,"['cumpl', 'product', 'especial', 'bien']",cumpl product especial bien,neutro,neutro
abominable producto peligroso inseguro evitar,negativo,"['abomin', 'product', 'peligr', 'insegur', 'evit']",abomin product peligr insegur evit,negativo,negativo
experiencia sin duda compraré nunca terrible aquí más,negativo,"['experient', 'dud', 'compr', 'nunc', 'terribl', 'aqu']",experient dud compr nunc terribl aqu,negativo,negativo
satisfecho compra superó muy expectativas,positivo,"['satisfech', 'compr', 'super', 'expect']",satisfech compr super expect,positivo,positivo
razonable pagado precio muy correcto para,neutro,"['razon', 'pag', 'preci', 'correct']",razon pag preci correct,neutro,neutro
inicio absolutamente mal defectuoso desde malísimo funciona,negativo,"['inici', 'absolut', 'mal', 'defectu', 'malisim', 'funcion']",inici absolut mal defectu malisim funcion,negativo,negativo
expectativas bajo rendimiento patético defraudado,negativo,"['expect', 'baj', 'rendimient', 'patet', 'defraud']",expect baj rendimient patet defraud,negativo,negativo
cliente nulo atención servicio completamente deplorable,negativo,"['client', 'nul', 'atencion', 'servici', 'complet', 'deplor']",client nul atencion servici complet deplor,negativo,negativo
producto ciertamente está bien nada especial cumple,neutro,"['product', 'ciert', 'bien', 'especial', 'cumpl']",product ciert bien especial cumpl,neutro,neutro
supera muy compra descripción feliz extraordinario,positivo,"['super', 'compr', 'descripcion', 'feliz', 'extraordinari']",super compr descripcion feliz extraordinari,positivo,positivo
esperaba cinco exactamente estrellas perfecto,positivo,"['esper', 'cinc', 'exact', 'estrell', 'perfect']",esper cinc exact estrell perfect,positivo,positivo
premium magnífico producto excepcional calidad,positivo,"['premium', 'magnif', 'product', 'excepcional', 'calid']",premium magnif product excepcional calid,positivo,positivo
espectacular contento buscaba muy justo,positivo,"['espectacul', 'content', 'busc', 'just']",espectacul content busc just,positivo,positivo
precio razonable totalmente para correcto pagado,neutro,"['preci', 'razon', 'total', 'correct', 'pag']",preci razon total correct pag,neutro,neutro
